{
  "version": "1",
  "plan": {
    "intent": "Does switching a lamp on resume every level inside it?"
  },
  "types": {
    "Lamp": "One lamp with a power switch, a dimmer and a colour switch."
  },
  "scenarios": [
    {
      "slug": "resume-blink",
      "text": "When a blinking lamp is switched off and on, it blinks again.",
      "walk": [
        {
          "place": "off",
          "does": "The lamp is off.",
          "expects": "No light."
        },
        {
          "place": "on",
          "does": "Someone switches it on.",
          "expects": "The lamp gives light."
        },
        {
          "place": "low",
          "does": "The lamp starts low.",
          "expects": "It glows dimly."
        },
        {
          "place": "high",
          "does": "Someone brightens it.",
          "expects": "It glows brightly."
        },
        {
          "place": "steady",
          "does": "The bright light holds.",
          "expects": "The light holds."
        },
        {
          "place": "blinking",
          "does": "Someone sets it blinking.",
          "expects": "The light flashes."
        },
        {
          "place": "steady",
          "does": "Someone stops the blinking.",
          "expects": "The light holds."
        },
        {
          "place": "high",
          "does": "It stays bright.",
          "expects": "It glows brightly."
        },
        {
          "place": "low",
          "does": "Someone dims it.",
          "expects": "It glows dimly."
        },
        {
          "place": "on",
          "does": "The lamp stays lit.",
          "expects": "It gives light."
        },
        {
          "place": "off",
          "does": "Someone switches it off.",
          "expects": "No light."
        }
      ]
    }
  ],
  "operations": [],
  "title": "Lamp entered deep by an edge",
  "level": {
    "kind": "state",
    "title": "Lamp power",
    "why": "A lamp is off or lit.",
    "subject": "Lamp",
    "initial": "off",
    "nodes": [
      {
        "id": "off",
        "label": "Off",
        "what": "No light."
      },
      {
        "id": "on",
        "label": "On",
        "what": "The lamp gives light.",
        "opens": {
          "kind": "state",
          "title": "Lit lamp",
          "why": "A lit lamp is low or high.",
          "subject": "Lamp",
          "initial": "low",
          "nodes": [
            {
              "id": "low",
              "label": "Low",
              "what": "The lamp glows dimly."
            },
            {
              "id": "high",
              "label": "High",
              "what": "The lamp glows brightly.",
              "opens": {
                "kind": "state",
                "title": "Bright lamp",
                "why": "A bright lamp is steady or blinking.",
                "subject": "Lamp",
                "initial": "steady",
                "nodes": [
                  {
                    "id": "steady",
                    "label": "Steady",
                    "what": "The light holds."
                  },
                  {
                    "id": "blinking",
                    "label": "Blinking",
                    "what": "The light flashes."
                  }
                ],
                "edges": [
                  {
                    "from": "steady",
                    "to": "blinking",
                    "label": "blink",
                    "what": "The lamp starts to flash.",
                    "mark": [
                      "happy"
                    ]
                  },
                  {
                    "from": "blinking",
                    "to": "steady",
                    "label": "hold",
                    "what": "The lamp stops flashing.",
                    "mark": [
                      "happy"
                    ]
                  }
                ]
              }
            }
          ],
          "edges": [
            {
              "from": "low",
              "to": "high",
              "label": "brighten",
              "what": "The dimmer goes up.",
              "mark": [
                "happy"
              ]
            },
            {
              "from": "high",
              "to": "low",
              "label": "dim",
              "what": "The dimmer goes down.",
              "mark": [
                "happy"
              ]
            }
          ]
        },
        "rules": [
          "resume-blinking"
        ]
      }
    ],
    "edges": [
      {
        "from": "off",
        "to": "on",
        "label": "switch on",
        "what": "The switch turns the lamp on.",
        "mark": [
          "happy"
        ],
        "enters": "deep"
      },
      {
        "from": "on",
        "to": "off",
        "label": "switch off",
        "what": "The switch turns the lamp off.",
        "mark": [
          "happy"
        ]
      }
    ]
  },
  "rules": [
    {
      "slug": "resume-blinking",
      "kind": "must",
      "formula": "always (all s: Lamp | (s in Blinking and after (s in Off and after s in On)) implies after after s in Blinking)",
      "text": "A lamp switched off while blinking comes back blinking."
    }
  ]
}
