{
  "version": "1",
  "plan": {
    "intent": "Does a repaired lamp start afresh while a switched one resumes?"
  },
  "types": {
    "Lamp": "One lamp with a power switch, a dimmer and a colour switch."
  },
  "scenarios": [
    {
      "slug": "resume-lamp",
      "text": "When a bright lamp is switched off and on, it comes back bright.",
      "walk": [
        {
          "place": "off",
          "does": "The lamp is off.",
          "expects": "No light."
        },
        {
          "place": "on",
          "does": "Someone switches it on.",
          "expects": "The lamp gives light."
        },
        {
          "place": "low",
          "does": "The lamp starts low.",
          "expects": "It glows dimly."
        },
        {
          "place": "high",
          "does": "Someone brightens it.",
          "expects": "It glows brightly."
        },
        {
          "place": "low",
          "does": "Someone dims it.",
          "expects": "It glows dimly."
        },
        {
          "place": "on",
          "does": "The lamp stays lit.",
          "expects": "It gives light."
        },
        {
          "place": "off",
          "does": "Someone switches it off.",
          "expects": "No light."
        }
      ]
    },
    {
      "slug": "repair-lamp",
      "text": "When a bright lamp breaks and is repaired, it starts low.",
      "walk": [
        {
          "place": "on",
          "does": "The lamp is lit.",
          "expects": "It gives light."
        },
        {
          "place": "high",
          "does": "Someone brightens it.",
          "expects": "It glows brightly."
        },
        {
          "place": "on",
          "does": "The lamp is lit.",
          "expects": "It gives light."
        },
        {
          "place": "broken",
          "does": "The lamp breaks.",
          "expects": "No light."
        },
        {
          "place": "on",
          "does": "Someone repairs it.",
          "expects": "The lamp gives light."
        },
        {
          "place": "low",
          "does": "The lamp starts afresh.",
          "expects": "It glows dimly."
        }
      ]
    }
  ],
  "operations": [],
  "title": "Lamp entered per edge",
  "level": {
    "kind": "state",
    "title": "Lamp power",
    "why": "A lamp is off or lit.",
    "subject": "Lamp",
    "initial": "off",
    "nodes": [
      {
        "id": "off",
        "label": "Off",
        "what": "No light."
      },
      {
        "id": "on",
        "label": "On",
        "what": "The lamp gives light.",
        "opens": {
          "kind": "state",
          "title": "Lit lamp",
          "why": "A lit lamp is low or high.",
          "subject": "Lamp",
          "initial": "low",
          "history": "shallow",
          "nodes": [
            {
              "id": "low",
              "label": "Low",
              "what": "The lamp glows dimly."
            },
            {
              "id": "high",
              "label": "High",
              "what": "The lamp glows brightly."
            }
          ],
          "edges": [
            {
              "from": "low",
              "to": "high",
              "label": "brighten",
              "what": "The dimmer goes up.",
              "mark": [
                "happy"
              ]
            },
            {
              "from": "high",
              "to": "low",
              "label": "dim",
              "what": "The dimmer goes down.",
              "mark": [
                "happy"
              ]
            }
          ]
        },
        "rules": [
          "repair-starts-low",
          "resume-brightness"
        ]
      },
      {
        "id": "broken",
        "label": "Broken",
        "what": "The lamp is broken and dark."
      }
    ],
    "edges": [
      {
        "from": "off",
        "to": "on",
        "label": "switch on",
        "what": "The switch turns the lamp on.",
        "mark": [
          "happy"
        ]
      },
      {
        "from": "on",
        "to": "off",
        "label": "switch off",
        "what": "The switch turns the lamp off.",
        "mark": [
          "happy"
        ]
      },
      {
        "from": "on",
        "to": "broken",
        "label": "break",
        "what": "The lamp breaks while lit.",
        "mark": [
          "failure"
        ]
      },
      {
        "from": "broken",
        "to": "on",
        "label": "repair",
        "what": "A repaired lamp starts afresh.",
        "enters": "initial",
        "mark": [
          "failure"
        ]
      }
    ]
  },
  "rules": [
    {
      "slug": "repair-starts-low",
      "kind": "must",
      "formula": "always (all s: Lamp | (s in Broken and after s in On) implies after s in Low)",
      "text": "A repaired lamp starts low, whatever it held before it broke."
    },
    {
      "slug": "resume-brightness",
      "kind": "must",
      "formula": "always (all s: Lamp | (s in High and after (s in Off and after s in On)) implies after after s in High)",
      "text": "A lamp switched off while high comes back high."
    }
  ]
}
