{
 "version": "1",
 "title": "Release",
 "plan": {
  "intent": "How does a change get released?"
 },
 "scenarios": [
  {
   "slug": "ship-change",
   "text": "When a change is ready, the pipeline builds it on the build server and ships it.",
   "walk": [
    {
     "place": "build",
     "does": "The pipeline builds the change.",
     "expects": "A package exists."
    },
    {
     "place": "server",
     "does": "The build server compiles the code.",
     "expects": "The package is on the server."
    },
    {
     "place": "cache",
     "does": "The server reuses old builds.",
     "expects": "Unchanged parts come from the cache."
    },
    {
     "place": "ship",
     "does": "The pipeline ships the package.",
     "expects": "The package is live."
    }
   ]
  }
 ],
 "operations": [],
 "rules": [
  {
   "slug": "packaged-first",
   "kind": "must",
   "formula": "some Package",
   "text": "A release ships a package."
  }
 ],
 "level": {
  "kind": "workflow",
  "title": "Release",
  "why": "The steps from change to live.",
  "nodes": [
   {
    "id": "build",
    "label": "Building change",
    "what": "Compile and test.",
    "link": "view",
    "opens": {
     "kind": "topology",
     "title": "Build server",
     "why": "What builds the change.",
     "nodes": [
      {
       "id": "server",
       "label": "Server",
       "what": "Runs the build."
      },
      {
       "id": "cache",
       "label": "Cache",
       "what": "Keeps old builds."
      }
     ],
     "edges": [
      {
       "from": "server",
       "to": "cache",
       "label": "reads builds",
       "what": "The server reuses old builds."
      }
     ]
    }
   },
   {
    "id": "ship",
    "label": "Shipping package",
    "what": "Deploy the package.",
    "rules": [
     "packaged-first"
    ]
   }
  ],
  "edges": [
   {
    "from": "build",
    "to": "ship",
    "label": "package",
    "what": "The built package.",
    "mark": [
     "happy"
    ]
   }
  ]
 }
}
